Category,English Word,German Speaker's Likely Pronunciation,Reason for Mispronunciation
Consonants,thin,sin,"German lacks the voiceless 'th' (/θ/) sound, often replacing it with /s/."
Consonants,this,zis,"German lacks the voiced 'th' (/ð/) sound, often replacing it with /z/."
Consonants,will,vill,"The English 'w' sound is often pronounced as a 'v' sound by German speakers."
Consonants,vet,wett,"The English 'v' sound is often pronounced as an 'f' sound (or a hard 'v') by German speakers."
Consonants,longer,long-ga(r),"In German, the 'g' sound never follows 'ng', so it is often omitted in English words where it should be present."
Consonants,finger,fin-ga(r),"Similar to 'longer', the 'g' is often omitted after 'ng'."
Vowels,pat,pet,"German lacks the /æ/ vowel (as in 'cat'), often using the /ɛ/ vowel (as in 'bed') instead."
Vowels,mat,met,"Confusion between the /æ/ and /ɛ/ sounds."
Vowels,shot,short (with long 'o'),"German lacks the open-back vowel /ɒ/ (as in 'not'), often using the mid-open /ɔ:/ vowel (as in 'nought') instead."
Vowels,so,saw,"German does not use the diphthong /əʊ/ (as in 'coat'), often replacing it with a monophthong sound closer to /ɔ:/."
Silent Letters,often,off-ten,"There are generally no silent letters in German, so the 't' in 'often' is often pronounced."
Complex Combinations,squirrel,sqwrrrrl/skwerl,"Challenging combination of 'sq' and 'rl' sounds, and the unique English 'r' sound."
Word Stress,record (noun),re-CORD,"Noun/verb stress differences; German has a more even stress pattern or different stress placement."
Word Stress,record (verb),RE-cord,"Noun/verb stress differences."
Idiosyncratic,physicist,physi-cist (stress),"Difficult due to multiple 's' sounds in a row, a tongue-twister."
Idiosyncratic,comfortable,comfort-able (stress),"Stress is often placed on the wrong syllable or all syllables are pronounced clearly."
